{
  "$schema": "https://json-schema.org/draft/2020-12/schema", "$id": "kilix.content.retention-admission/v1", "type": "object", "additionalProperties": false,
  "required": ["schema", "kind", "version", "release_id", "stable_slot_digest", "authority_digest", "output_digest", "counts_digest", "account_digest", "admission_closed", "account_quarantined", "pending_relation", "incomplete_representation", "limit_exceeded", "reasons"],
  "properties": {"schema": {"const": "kilix.content.retention/v1"}, "kind": {"const": "admission"}, "version": {"type": "integer", "const": 1}, "release_id": {"type": "string", "pattern": "^[a-z0-9][a-z0-9._-]{0,63}$"}, "stable_slot_digest": {"type": "string", "pattern": "^[0-9a-f]{64}$"}, "authority_digest": {"type": "string", "pattern": "^[0-9a-f]{64}$"}, "output_digest": {"type": "string", "pattern": "^[0-9a-f]{64}$"}, "counts_digest": {"type": "string", "pattern": "^[0-9a-f]{64}$"}, "account_digest": {"type": "string", "pattern": "^[0-9a-f]{64}$"}, "admission_closed": {"type": "boolean"}, "account_quarantined": {"type": "boolean"}, "pending_relation": {"type": "boolean"}, "incomplete_representation": {"type": "boolean"}, "limit_exceeded": {"type": "boolean"}, "reasons": {"type": "array", "uniqueItems": true, "items": {"enum": ["account_quarantined", "pending_relation", "incomplete_representation", "limit_exceeded"]}}}
}
