{"account_digest":"0000000000000000000000000000000000000000000000000000000000000060","account_quarantined":false,"admission_closed":false,"authority_digest":"0000000000000000000000000000000000000000000000000000000000000010","counts_digest":"0000000000000000000000000000000000000000000000000000000000000061","incomplete_representation":false,"kind":"admission","limit_exceeded":false,"output_digest":"0000000000000000000000000000000000000000000000000000000000000017","pending_relation":false,"reasons":[],"release_id":"release-0.2.1","schema":"kilix.content.retention/v1","stable_slot_digest":"0000000000000000000000000000000000000000000000000000000000000033","version":1}
